[
  {
    "classId": "warrior",
    "id": "berserker",
    "name": "Berserker",
    "description": "Two-handed glass cannon. Pile STR for raw damage and just enough CON to outlast the second pack. INT untouched. Whirlwind clears trash, Battle Cry covers the back rank.",
    "targetAttrs": {
      "STR": 55,
      "DEX": 15,
      "INT": 0,
      "CON": 30
    },
    "plateaus": {},
    "weapons": [
      "axe2h",
      "sword2h",
      "hammer"
    ],
    "shieldPref": "never",
    "preferredSkills": [
      "whirlwind",
      "battle_cry",
      "unbreakable",
      "shield_bash"
    ],
    "tags": [
      "heavy",
      "dps"
    ]
  },
  {
    "classId": "warrior",
    "id": "guardian",
    "name": "Guardian",
    "description": "Sword-and-board frontline tank. CON majority so HP can soak hits; STR for shield bash damage. Unbreakable + Battle Cry keep the team alive.",
    "targetAttrs": {
      "STR": 30,
      "DEX": 10,
      "INT": 0,
      "CON": 60
    },
    "plateaus": {
      "CON": {
        "atLeast": 0.5
      }
    },
    "weapons": [
      "sword",
      "hammer"
    ],
    "shieldPref": "always",
    "preferredSkills": [
      "unbreakable",
      "shield_bash",
      "battle_cry",
      "whirlwind"
    ],
    "tags": [
      "heavy",
      "tank"
    ]
  },
  {
    "classId": "fighter",
    "id": "execution",
    "name": "Execution (2H)",
    "description": "Two-handed precision damage. STR-heavy, modest CON, no INT. Sunder Armor → Precise Strike combo deletes priority targets.",
    "targetAttrs": {
      "STR": 55,
      "DEX": 15,
      "INT": 0,
      "CON": 30
    },
    "plateaus": {},
    "weapons": [
      "sword2h",
      "axe2h",
      "hammer"
    ],
    "shieldPref": "never",
    "preferredSkills": [
      "precise_strike",
      "sunder_armor",
      "offensive_stance",
      "second_wind"
    ],
    "tags": [
      "heavy",
      "dps"
    ]
  },
  {
    "classId": "fighter",
    "id": "frenzy",
    "name": "Frenzy (Dual)",
    "description": "Dual-wielding blender. DEX matters as much as STR for the rapid-strike cadence. Riposte counters when low. INT untouched.",
    "targetAttrs": {
      "STR": 35,
      "DEX": 40,
      "INT": 0,
      "CON": 25
    },
    "plateaus": {
      "DEX": {
        "until": "hit95"
      }
    },
    "weapons": [
      "sword",
      "dagger"
    ],
    "shieldPref": "never",
    "preferredSkills": [
      "riposte",
      "precise_strike",
      "offensive_stance",
      "second_wind"
    ],
    "tags": [
      "light",
      "dps"
    ]
  },
  {
    "classId": "fighter",
    "id": "protector",
    "name": "Protector",
    "description": "One-hand + shield wall. CON-led tank with enough STR for Riposte counters. Defensive Stance up at all times.",
    "targetAttrs": {
      "STR": 25,
      "DEX": 10,
      "INT": 0,
      "CON": 65
    },
    "plateaus": {
      "CON": {
        "atLeast": 0.5
      }
    },
    "weapons": [
      "sword",
      "hammer"
    ],
    "shieldPref": "always",
    "preferredSkills": [
      "defensive_stance",
      "riposte",
      "second_wind",
      "sunder_armor"
    ],
    "tags": [
      "heavy",
      "tank"
    ]
  },
  {
    "classId": "paladin",
    "id": "holy_warrior",
    "name": "Holy Warrior",
    "description": "STR-led smiter. Holy Strike resolves to heavy-mode with a sword/hammer; Lay on Hands keeps the party up. Some CON for survivability.",
    "targetAttrs": {
      "STR": 50,
      "DEX": 10,
      "INT": 10,
      "CON": 30
    },
    "plateaus": {},
    "weapons": [
      "sword",
      "hammer"
    ],
    "shieldPref": "sometimes",
    "preferredSkills": [
      "holy_strike",
      "lay_on_hands",
      "consecration",
      "divine_shield"
    ],
    "tags": [
      "heavy",
      "hybrid"
    ]
  },
  {
    "classId": "paladin",
    "id": "lightbringer",
    "name": "Lightbringer",
    "description": "INT-led caster paladin. Holy Strike resolves to magic-mode with a scepter; Consecration zone-locks packs. Spell power scales the kit.",
    "targetAttrs": {
      "STR": 15,
      "DEX": 5,
      "INT": 50,
      "CON": 30
    },
    "plateaus": {},
    "weapons": [
      "scepter",
      "staff"
    ],
    "shieldPref": "never",
    "preferredSkills": [
      "holy_strike",
      "consecration",
      "lay_on_hands",
      "divine_shield"
    ],
    "tags": [
      "magic",
      "hybrid"
    ]
  },
  {
    "classId": "ranger",
    "id": "sharpshooter",
    "name": "Sharpshooter",
    "description": "DEX-stacked single-target. Aimed Shot melts a priority enemy each round; Smoke Trap covers retreat.",
    "targetAttrs": {
      "STR": 5,
      "DEX": 65,
      "INT": 0,
      "CON": 30
    },
    "plateaus": {
      "DEX": {
        "until": "hit95"
      }
    },
    "weapons": [
      "bow",
      "crossbow"
    ],
    "shieldPref": "never",
    "preferredSkills": [
      "aimed_shot",
      "smoke_trap",
      "multi_shot",
      "rain_of_arrows"
    ],
    "tags": [
      "light",
      "dps"
    ]
  },
  {
    "classId": "ranger",
    "id": "volley",
    "name": "Volley",
    "description": "AoE rain-of-arrows ranger. DEX still primary but more CON to survive the long fights. Rain of Arrows + Multi Shot trash clear.",
    "targetAttrs": {
      "STR": 5,
      "DEX": 50,
      "INT": 0,
      "CON": 45
    },
    "plateaus": {
      "DEX": {
        "until": "hit95"
      }
    },
    "weapons": [
      "bow",
      "crossbow"
    ],
    "shieldPref": "never",
    "preferredSkills": [
      "rain_of_arrows",
      "multi_shot",
      "aimed_shot",
      "smoke_trap"
    ],
    "tags": [
      "light",
      "dps"
    ]
  },
  {
    "classId": "rogue",
    "id": "assassin",
    "name": "Assassin",
    "description": "Backstab + Death Mark burst. DEX dominant, low CON. Poison Blade extends the kill window.",
    "targetAttrs": {
      "STR": 5,
      "DEX": 65,
      "INT": 0,
      "CON": 30
    },
    "plateaus": {
      "DEX": {
        "until": "hit95"
      }
    },
    "weapons": [
      "dagger"
    ],
    "shieldPref": "never",
    "preferredSkills": [
      "backstab",
      "death_mark",
      "poison_blade",
      "shadow_step"
    ],
    "tags": [
      "light",
      "dps"
    ]
  },
  {
    "classId": "rogue",
    "id": "saboteur",
    "name": "Saboteur",
    "description": "Survival-biased rogue. DEX still primary for hits, but CON climbs so Shadow Step gets you out alive. Poison Blade + Death Mark do the damage over time so you never need to stay in melee long.",
    "targetAttrs": {
      "STR": 5,
      "DEX": 45,
      "INT": 0,
      "CON": 50
    },
    "plateaus": {
      "DEX": {
        "until": "hit95"
      },
      "CON": {
        "atLeast": 0.4
      }
    },
    "weapons": [
      "dagger"
    ],
    "shieldPref": "never",
    "preferredSkills": [
      "poison_blade",
      "shadow_step",
      "death_mark",
      "backstab"
    ],
    "tags": [
      "light",
      "hybrid"
    ]
  },
  {
    "classId": "mage",
    "id": "evoker",
    "name": "Evoker",
    "description": "INT-stacked nuker. Fireball + Meteor; CON only enough to survive incidental hits. Spell power compounds via gear affixes.",
    "targetAttrs": {
      "STR": 0,
      "DEX": 5,
      "INT": 70,
      "CON": 25
    },
    "plateaus": {},
    "weapons": [
      "staff",
      "wand"
    ],
    "shieldPref": "never",
    "preferredSkills": [
      "fireball",
      "meteor",
      "magic_missile",
      "frost_bolt"
    ],
    "tags": [
      "magic",
      "caster"
    ]
  },
  {
    "classId": "mage",
    "id": "arcanist",
    "name": "Arcanist",
    "description": "Hardened caster build. INT still leads but CON climbs so the glass cannon stops being glass. Blizzard slows incoming damage, Arcane Surge bursts when needed.",
    "targetAttrs": {
      "STR": 0,
      "DEX": 5,
      "INT": 50,
      "CON": 45
    },
    "plateaus": {
      "CON": {
        "atLeast": 0.4
      }
    },
    "weapons": [
      "staff",
      "wand"
    ],
    "shieldPref": "never",
    "preferredSkills": [
      "blizzard",
      "arcane_surge",
      "magic_missile",
      "fireball"
    ],
    "tags": [
      "magic",
      "hybrid"
    ]
  },
  {
    "classId": "cleric",
    "id": "shepherd",
    "name": "Shepherd",
    "description": "Heal-first cleric. INT majority for Mass Resurrection scaling, CON for survivability. Sanctuary covers a fragile caster.",
    "targetAttrs": {
      "STR": 5,
      "DEX": 5,
      "INT": 55,
      "CON": 35
    },
    "plateaus": {},
    "weapons": [
      "staff",
      "scepter"
    ],
    "shieldPref": "sometimes",
    "preferredSkills": [
      "heal",
      "mass_resurrection",
      "sanctuary",
      "smite"
    ],
    "tags": [
      "magic",
      "support"
    ]
  },
  {
    "classId": "cleric",
    "id": "warpriest",
    "name": "Warpriest",
    "description": "Tank-leaning cleric. CON tops the spread so the healer is also the rock. Smite and Sanctuary keep the line stable; Heal still comes through INT-scaling gear.",
    "targetAttrs": {
      "STR": 10,
      "DEX": 5,
      "INT": 35,
      "CON": 50
    },
    "plateaus": {
      "CON": {
        "atLeast": 0.4
      }
    },
    "weapons": [
      "scepter",
      "staff"
    ],
    "shieldPref": "always",
    "preferredSkills": [
      "sanctuary",
      "heal",
      "smite",
      "mass_resurrection"
    ],
    "tags": [
      "magic",
      "tank"
    ]
  },
  {
    "classId": "bard",
    "id": "flair",
    "name": "Flair",
    "description": "Builds Flair stacks then unloads. Hybrid DEX/INT split per Bard kit; some CON.",
    "targetAttrs": {
      "STR": 0,
      "DEX": 35,
      "INT": 35,
      "CON": 30
    },
    "plateaus": {
      "DEX": {
        "until": "hit95"
      }
    },
    "weapons": [
      "sword",
      "dagger"
    ],
    "shieldPref": "never",
    "preferredSkills": [
      "grandeur",
      "inspiring_song",
      "discordant_wail",
      "lullaby"
    ],
    "tags": [